01:47:46.496046 IP 192.168.170.8.32795 > 192.168.170.20.domain: 4146+ TXT? google.com. (28)
01:47:46.496576 IP 192.168.170.20.domain > 192.168.170.8.32795: 4146 1/0/0 TXT "v=spf1 ptr ?all" (56)
01:47:50.501268 IP 192.168.170.8.32795 > 192.168.170.20.domain: 63343+ MX? google.com. (28)
01:47:51.333401 IP 192.168.170.20.domain > 192.168.170.8.32795: 63343 6/0/6 MX smtp4.google.com. 40, MX smtp5.google.com. 10, MX smtp6.google.com. 10, MX smtp1.google.com. 10, MX smtp2.google.com. 10, MX smtp3.google.com. 40 (256)
01:47:59.313231 IP 192.168.170.8.32795 > 192.168.170.20.domain: 18849+ LOC? google.com. (28)
01:47:59.452255 IP 192.168.170.20.domain > 192.168.170.8.32795: 18849 0/0/0 (28)
01:48:07.320873 IP 192.168.170.8.32795 > 192.168.170.20.domain: 39867+ PTR? 104.9.192.66.in-addr.arpa. (43)
01:48:07.321379 IP 192.168.170.20.domain > 192.168.170.8.32795: 39867 1/0/0 PTR 66-192-9-104.gen.twtelecom.net. (87)
01:49:18.685951 IP 192.168.170.8.32795 > 192.168.170.20.domain: 30144+ A? www.netbsd.org. (32)
01:49:18.734862 IP 192.168.170.20.domain > 192.168.170.8.32795: 30144 1/0/0 A 204.152.190.12 (48)
01:49:35.461181 IP 192.168.170.8.32795 > 192.168.170.20.domain: 61652+ AAAA? www.netbsd.org. (32)
01:49:35.698849 IP 192.168.170.20.domain > 192.168.170.8.32795: 61652 1/0/0 AAAA 2001:4f8:4:7:2e0:81ff:fe52:9a6b (60)
01:50:35.523440 IP 192.168.170.8.32795 > 192.168.170.20.domain: 32569+ AAAA? www.netbsd.org. (32)
01:50:35.523827 IP 192.168.170.20.domain > 192.168.170.8.32795: 32569 1/0/0 AAAA 2001:4f8:4:7:2e0:81ff:fe52:9a6b (60)
01:50:44.735890 IP 192.168.170.8.32795 > 192.168.170.20.domain: 36275+ AAAA? www.google.com. (32)
01:50:44.752428 IP 192.168.170.20.domain > 192.168.170.8.32795: 36275 1/0/0 CNAME www.l.google.com. (52)
01:50:54.349862 IP 192.168.170.8.32795 > 192.168.170.20.domain: 56482+ AAAA? www.l.google.com. (34)
01:50:54.366527 IP 192.168.170.20.domain > 192.168.170.8.32795: 56482 0/0/0 (34)
01:51:35.204348 IP 192.168.170.8.32795 > 192.168.170.20.domain: 48159+ AAAA? www.example.com. (33)
01:51:35.437491 IP 192.168.170.20.domain > 192.168.170.8.32795: 48159 0/0/0 (33)
01:51:46.819984 IP 192.168.170.8.32795 > 192.168.170.20.domain: 9837+ AAAA? www.example.notginh. (37)
01:51:47.032976 IP 192.168.170.20.domain > 192.168.170.8.32795: 9837 NXDomain* 0/0/0 (37)
01:52:17.660780 IP 192.168.170.8.32795 > 192.168.170.20.domain: 65251+ ANY? www.isc.org. (29)
01:52:17.733384 IP 192.168.170.20.domain > 192.168.170.8.32795: 65251 2/0/0 AAAA 2001:4f8:0:2::d, A 204.152.184.88 (73)
01:52:17.737204 IP 192.168.170.8.32796 > 192.168.170.20.domain: 23123+ PTR? 1.0.0.127.in-addr.arpa. (40)
01:52:17.737792 IP 192.168.170.20.domain > 192.168.170.8.32796: 23123* 1/0/0 PTR localhost. (63)
01:52:17.740166 IP 192.168.170.8.32797 > 192.168.170.20.domain: 8330+ NS? isc.org. (25)
01:52:17.755930 IP 192.168.170.56.vdmplay > dns03.nextgentel.net.domain: 12910+ SRV? _ldap._tcp.Default-First-Site-Name._sites.dc._msdcs.utelsystems.local. (87)
01:52:17.758453 IP 192.168.170.20.domain > 192.168.170.8.32797: 8330 4/0/0 NS ns-ext.nrt1.isc.org., NS ns-ext.sth1.isc.org., NS ns-ext.isc.org., NS ns-ext.lga1.isc.org. (124)
01:52:17.775741 IP dns03.nextgentel.net.domain > 192.168.170.56.vdmplay: 12910 NXDomain* 0/0/0 (87)
01:52:17.776396 IP 192.168.170.56.gat-lmd > dns03.nextgentel.net.domain: 61793+ SRV? _ldap._tcp.dc._msdcs.utelsystems.local. (56)
01:52:17.793697 IP dns03.nextgentel.net.domain > 192.168.170.56.gat-lmd: 61793 NXDomain* 0/0/0 (56)
01:52:17.794240 IP 192.168.170.56.centra > dns03.nextgentel.net.domain: 33633+ SRV? _ldap._tcp.05b5292b-34b8-4fb7-85a3-8beef5fd2069.domains._msdcs.utelsystems.local. (98)
01:52:17.813924 IP dns03.nextgentel.net.domain > 192.168.170.56.centra: 33633 NXDomain* 0/0/0 (98)
01:52:17.915705 IP 192.168.170.56.impera > dns03.nextgentel.net.domain: 53344+ A? GRIMM.utelsystems.local. (41)
01:52:17.932629 IP dns03.nextgentel.net.domain > 192.168.170.56.impera: 53344 NXDomain* 0/0/0 (41)
01:52:25.357346 IP 192.168.170.56.pptconference > dns03.nextgentel.net.domain: 30307+ A? GRIMM.utelsystems.local. (41)
01:52:25.375359 IP dns03.nextgentel.net.domain > 192.168.170.56.pptconference: 30307 NXDomain* 0/0/0 (41)
